{
  "slug": "chemfield",
  "name": "ChemField",
  "accent": "#3fb6a8",
  "tagline": "Getekende scheikunde-feiten uit slak, klei en leach — peer-gevalideerd.",
  "status": "live",
  "order": 0,
  "taxonomy": ["leaching", "vanadium", "clay", "slag"],
  "links": { "repo": "https://github.com/ChemField/openchem" }
}
